reading from file capture.pcap, link-type LINUX_SLL2 (Linux cooked v2), snapshot length 262144
Warning: interface names might be incorrect
00:40:07.505776 enp45s0 Out IP 172.17.0.3.27597 > 172.17.0.4.6443: Flags [.], ack 4238404303, win 607, options [nop,nop,TS val 3865601607 ecr 1019778760], length 0
00:40:07.691024 enp45s0 Out IP 172.17.0.3.49938 > 172.17.0.4.6443: Flags [P.], seq 3299396520:3299396558, ack 3788125840, win 9801, options [nop,nop,TS val 3648977840 ecr 1019778703], length 38
00:40:07.694104 enp45s0 In  IP 172.17.0.4.6443 > 172.17.0.3.49938: Flags [P.], seq 1:67, ack 38, win 9411, options [nop,nop,TS val 1019778989 ecr 3648977840], length 66
00:40:07.694156 enp45s0 Out IP 172.17.0.3.49938 > 172.17.0.4.6443: Flags [.], ack 67, win 9801, options [nop,nop,TS val 3648977843 ecr 1019778989], length 0
00:40:07.694205 enp45s0 In  IP 172.17.0.4.6443 > 172.17.0.3.49938: Flags [P.], seq 67:4005, ack 38, win 9411, options [nop,nop,TS val 1019778989 ecr 3648977843], length 3938
00:40:07.694215 enp45s0 Out IP 172.17.0.3.49938 > 172.17.0.4.6443: Flags [.], ack 4005, win 9783, options [nop,nop,TS val 3648977843 ecr 1019778989], length 0
00:40:07.694359 enp45s0 Out IP 172.17.0.3.49938 > 172.17.0.4.6443: Flags [P.], seq 38:73, ack 4005, win 9801, options [nop,nop,TS val 3648977843 ecr 1019778989], length 35
00:40:07.695057 enp45s0 Out IP 172.17.0.3.49938 > 172.17.0.4.6443: Flags [P.], seq 73:117, ack 4005, win 9801, options [nop,nop,TS val 3648977844 ecr 1019778989], length 44
00:40:07.695095 enp45s0 Out IP 172.17.0.3.49938 > 172.17.0.4.6443: Flags [P.], seq 117:1047, ack 4005, win 9801, options [nop,nop,TS val 3648977844 ecr 1019778989], length 930
00:40:07.695127 enp45s0 In  IP 172.17.0.4.6443 > 172.17.0.3.49938: Flags [.], ack 117, win 9411, options [nop,nop,TS val 1019778990 ecr 3648977843], length 0
00:40:07.703958 enp45s0 In  IP 172.17.0.4.6443 > 172.17.0.3.49938: Flags [P.], seq 4005:4075, ack 1047, win 9411, options [nop,nop,TS val 1019778999 ecr 3648977844], length 70
00:40:07.704035 enp45s0 In  IP 172.17.0.4.6443 > 172.17.0.3.49938: Flags [P.], seq 4075:8193, ack 1047, win 9411, options [nop,nop,TS val 1019778999 ecr 3648977844], length 4118
00:40:07.704068 enp45s0 In  IP 172.17.0.4.6443 > 172.17.0.3.27597: Flags [P.], seq 1:5971, ack 0, win 578, options [nop,nop,TS val 1019778999 ecr 3865601607], length 5970
00:40:07.704074 enp45s0 In  IP 172.17.0.4.6443 > 172.17.0.3.3664: Flags [P.], seq 2281483826:2281487775, ack 1234296482, win 615, options [nop,nop,TS val 1019778999 ecr 3865600846], length 3949
00:40:07.704081 enp45s0 In  IP 172.17.0.4.6443 > 172.17.0.3.49938: Flags [P.], seq 8193:11953, ack 1047, win 9411, options [nop,nop,TS val 1019778999 ecr 3648977844], length 3760
00:40:07.704108 enp45s0 Out IP 172.17.0.3.49938 > 172.17.0.4.6443: Flags [.], ack 11953, win 9801, options [nop,nop,TS val 3648977853 ecr 1019778999], length 0
00:40:07.704127 enp45s0 Out IP 172.17.0.3.27597 > 172.17.0.4.6443: Flags [.], ack 5971, win 607, options [nop,nop,TS val 3865601805 ecr 1019778999], length 0
00:40:07.704188 enp45s0 Out IP 172.17.0.3.3664 > 172.17.0.4.6443: Flags [.], ack 3949, win 12435, options [nop,nop,TS val 3865601805 ecr 1019778999], length 0
00:40:07.704323 enp45s0 Out IP 172.17.0.3.27597 > 172.17.0.4.6443: Flags [P.], seq 0:35, ack 5971, win 607, options [nop,nop,TS val 3865601805 ecr 1019778999], length 35
00:40:07.704328 enp45s0 Out IP 172.17.0.3.3664 > 172.17.0.4.6443: Flags [P.], seq 1:36, ack 3949, win 12435, options [nop,nop,TS val 3865601805 ecr 1019778999], length 35
00:40:07.704356 enp45s0 In  IP 172.17.0.4.6443 > 172.17.0.3.3664: Flags [.], ack 36, win 615, options [nop,nop,TS val 1019778999 ecr 3865601805], length 0
00:40:07.704473 enp45s0 Out IP 172.17.0.3.27597 > 172.17.0.4.6443: Flags [P.], seq 35:83, ack 5971, win 607, options [nop,nop,TS val 3865601805 ecr 1019778999], length 48
00:40:07.704514 enp45s0 Out IP 172.17.0.3.49938 > 172.17.0.4.6443: Flags [P.], seq 1047:1082, ack 11953, win 9801, options [nop,nop,TS val 3648977853 ecr 1019778999], length 35
00:40:07.704563 enp45s0 In  IP 172.17.0.4.6443 > 172.17.0.3.27597: Flags [.], ack 83, win 578, options [nop,nop,TS val 1019778999 ecr 3865601805], length 0
00:40:07.744825 enp45s0 In  IP 172.17.0.4.6443 > 172.17.0.3.49938: Flags [.], ack 1082, win 9411, options [nop,nop,TS val 1019779040 ecr 3648977853], length 0
00:40:07.758179 ?     P   IP 10.244.2.2 > dns.google: ICMP echo request, id 685, seq 1, length 64
00:40:07.758209 ?     In  IP 10.244.2.2 > dns.google: ICMP echo request, id 685, seq 1, length 64
00:40:07.758235 enp45s0 Out IP 172.17.0.3 > dns.google: ICMP echo request, id 685, seq 1, length 64
00:40:07.813613 enp45s0 In  IP dns.google > 172.17.0.3: ICMP echo reply, id 685, seq 1, length 64
00:40:07.813635 ?     Out IP dns.google > 10.244.2.2: ICMP echo reply, id 685, seq 1, length 64
00:40:07.813652 ?     Out IP dns.google > 10.244.2.2: ICMP echo reply, id 685, seq 1, length 64
00:40:07.834936 enp45s0 Out IP 172.17.0.3.10351 > 172.17.0.2.10351: UDP, length 102
00:40:07.835220 enp45s0 In  IP 172.17.0.2.10351 > 172.17.0.3.10351: UDP, length 20
00:40:08.002090 enp45s0 In  IP 172.17.0.2.41776 > 172.17.0.3.10351: Flags [S], seq 4054204377, win 64240, options [mss 1460,sackOK,TS val 1484057227 ecr 0,nop,wscale 7], length 0
00:40:08.002154 enp45s0 Out IP 172.17.0.3.10351 > 172.17.0.2.41776: Flags [S.], seq 2816002774, ack 4054204378, win 65160, options [mss 1460,sackOK,TS val 3254351229 ecr 1484057227,nop,wscale 7], length 0
00:40:08.002205 enp45s0 In  IP 172.17.0.2.41776 > 172.17.0.3.10351: Flags [.], ack 1, win 502, options [nop,nop,TS val 1484057227 ecr 3254351229], length 0
00:40:08.002221 enp45s0 Out IP 172.17.0.3.53642 > 172.17.0.4.10351: Flags [S], seq 1849234781, win 64240, options [mss 1460,sackOK,TS val 3648978151 ecr 0,nop,wscale 7], length 0
00:40:08.002299 enp45s0 In  IP 172.17.0.4.10351 > 172.17.0.3.53642: Flags [S.], seq 1006896573, ack 1849234782, win 65160, options [mss 1460,sackOK,TS val 1019779297 ecr 3648978151,nop,wscale 7], length 0
00:40:08.002325 enp45s0 Out IP 172.17.0.3.53642 > 172.17.0.4.10351: Flags [.], ack 1, win 502, options [nop,nop,TS val 3648978151 ecr 1019779297], length 0
00:40:08.002417 enp45s0 In  IP 172.17.0.4.49832 > 172.17.0.3.10351: Flags [S], seq 4265996311, win 64240, options [mss 1460,sackOK,TS val 1019779297 ecr 0,nop,wscale 7], length 0
00:40:08.002458 enp45s0 Out IP 172.17.0.3.10351 > 172.17.0.4.49832: Flags [S.], seq 2751043119, ack 4265996312, win 65160, options [mss 1460,sackOK,TS val 3648978151 ecr 1019779297,nop,wscale 7], length 0
00:40:08.002497 enp45s0 In  IP 172.17.0.4.49832 > 172.17.0.3.10351: Flags [.], ack 1, win 502, options [nop,nop,TS val 1019779297 ecr 3648978151], length 0
00:40:08.002522 enp45s0 In  IP 172.17.0.2.41776 > 172.17.0.3.10351: Flags [P.], seq 1:238, ack 1, win 502, options [nop,nop,TS val 1484057227 ecr 3254351229], length 237
00:40:08.002546 enp45s0 Out IP 172.17.0.3.10351 > 172.17.0.2.41776: Flags [.], ack 238, win 508, options [nop,nop,TS val 3254351229 ecr 1484057227], length 0
00:40:08.002555 enp45s0 Out IP 172.17.0.3.53642 > 172.17.0.4.10351: Flags [P.], seq 1:238, ack 1, win 502, options [nop,nop,TS val 3648978151 ecr 1019779297], length 237
00:40:08.002585 enp45s0 In  IP 172.17.0.4.10351 > 172.17.0.3.53642: Flags [.], ack 238, win 508, options [nop,nop,TS val 1019779297 ecr 3648978151], length 0
00:40:08.002799 enp45s0 In  IP 172.17.0.4.49832 > 172.17.0.3.10351: Flags [P.], seq 1:238, ack 1, win 502, options [nop,nop,TS val 1019779298 ecr 3648978151], length 237
00:40:08.002819 enp45s0 Out IP 172.17.0.3.10351 > 172.17.0.4.49832: Flags [.], ack 238, win 508, options [nop,nop,TS val 3648978152 ecr 1019779298], length 0
00:40:08.002904 enp45s0 Out IP 172.17.0.3.10351 > 172.17.0.2.41776: Flags [P.], seq 1:238, ack 238, win 508, options [nop,nop,TS val 3254351230 ecr 1484057227], length 237
00:40:08.002917 enp45s0 In  IP 172.17.0.4.10351 > 172.17.0.3.53642: Flags [P.], seq 1:238, ack 238, win 508, options [nop,nop,TS val 1019779298 ecr 3648978151], length 237
00:40:08.002946 enp45s0 Out IP 172.17.0.3.53642 > 172.17.0.4.10351: Flags [.], ack 238, win 501, options [nop,nop,TS val 3648978152 ecr 1019779298], length 0
00:40:08.002958 enp45s0 In  IP 172.17.0.2.41776 > 172.17.0.3.10351: Flags [.], ack 238, win 501, options [nop,nop,TS val 1484057228 ecr 3254351230], length 0
00:40:08.003013 enp45s0 In  IP 172.17.0.4.10351 > 172.17.0.3.53642: Flags [F.], seq 238, ack 238, win 508, options [nop,nop,TS val 1019779298 ecr 3648978152], length 0
00:40:08.003058 enp45s0 Out IP 172.17.0.3.10351 > 172.17.0.4.49832: Flags [P.], seq 1:238, ack 238, win 508, options [nop,nop,TS val 3648978152 ecr 1019779298], length 237
00:40:08.003059 enp45s0 Out IP 172.17.0.3.53642 > 172.17.0.4.10351: Flags [F.], seq 238, ack 239, win 501, options [nop,nop,TS val 3648978152 ecr 1019779298], length 0
00:40:08.003092 enp45s0 In  IP 172.17.0.4.49832 > 172.17.0.3.10351: Flags [.], ack 238, win 501, options [nop,nop,TS val 1019779298 ecr 3648978152], length 0
00:40:08.003096 enp45s0 In  IP 172.17.0.4.10351 > 172.17.0.3.53642: Flags [.], ack 239, win 508, options [nop,nop,TS val 1019779298 ecr 3648978152], length 0
00:40:08.003111 enp45s0 Out IP 172.17.0.3.10351 > 172.17.0.2.41776: Flags [F.], seq 238, ack 238, win 508, options [nop,nop,TS val 3254351230 ecr 1484057228], length 0
00:40:08.003130 enp45s0 Out IP 172.17.0.3.10351 > 172.17.0.4.49832: Flags [F.], seq 238, ack 238, win 508, options [nop,nop,TS val 3648978152 ecr 1019779298], length 0
00:40:08.003132 enp45s0 In  IP 172.17.0.2.41776 > 172.17.0.3.10351: Flags [F.], seq 238, ack 238, win 501, options [nop,nop,TS val 1484057228 ecr 3254351230], length 0
00:40:08.003149 enp45s0 Out IP 172.17.0.3.10351 > 172.17.0.2.41776: Flags [.], ack 239, win 508, options [nop,nop,TS val 3254351230 ecr 1484057228], length 0
00:40:08.003169 enp45s0 In  IP 172.17.0.2.41776 > 172.17.0.3.10351: Flags [.], ack 239, win 501, options [nop,nop,TS val 1484057228 ecr 3254351230], length 0
00:40:08.003235 enp45s0 In  IP 172.17.0.4.49832 > 172.17.0.3.10351: Flags [F.], seq 238, ack 239, win 501, options [nop,nop,TS val 1019779298 ecr 3648978152], length 0
00:40:08.003261 enp45s0 Out IP 172.17.0.3.10351 > 172.17.0.4.49832: Flags [.], ack 239, win 508, options [nop,nop,TS val 3648978152 ecr 1019779298], length 0
00:40:08.758365 ?     P   IP 10.244.2.2 > dns.google: ICMP echo request, id 685, seq 2, length 64
00:40:08.758400 ?     In  IP 10.244.2.2 > dns.google: ICMP echo request, id 685, seq 2, length 64
00:40:08.758430 enp45s0 Out IP 172.17.0.3 > dns.google: ICMP echo request, id 685, seq 2, length 64
00:40:08.822869 enp45s0 In  IP dns.google > 172.17.0.3: ICMP echo reply, id 685, seq 2, length 64
00:40:08.822896 ?     Out IP dns.google > 10.244.2.2: ICMP echo reply, id 685, seq 2, length 64
00:40:08.822913 ?     Out IP dns.google > 10.244.2.2: ICMP echo reply, id 685, seq 2, length 64
00:40:08.834762 enp45s0 Out IP 172.17.0.3.10351 > 172.17.0.4.10351: UDP, length 108
00:40:08.834994 enp45s0 In  IP 172.17.0.4.10351 > 172.17.0.3.10351: UDP, length 20
00:40:09.206671 enp45s0 In  IP 172.17.0.4.10351 > 172.17.0.3.10351: UDP, length 108
00:40:09.206958 enp45s0 Out IP 172.17.0.3.10351 > 172.17.0.4.10351: UDP, length 20
00:40:09.255263 lo    In  IP6 ip6-localhost.44964 > ip6-localhost.10350: Flags [S], seq 4012541066, win 65476, options [mss 65476,sackOK,TS val 646605993 ecr 0,nop,wscale 7], length 0
00:40:09.255263 lo    In  IP6 ip6-localhost.44954 > ip6-localhost.10350: Flags [S], seq 3296280147, win 65476, options [mss 65476,sackOK,TS val 646605993 ecr 0,nop,wscale 7], length 0
00:40:09.255295 lo    In  IP6 ip6-localhost.10350 > ip6-localhost.44954: Flags [S.], seq 711535498, ack 3296280148, win 65464, options [mss 65476,sackOK,TS val 646605993 ecr 646605993,nop,wscale 7], length 0
00:40:09.255295 lo    In  IP6 ip6-localhost.10350 > ip6-localhost.44964: Flags [S.], seq 3625886278, ack 4012541067, win 65464, options [mss 65476,sackOK,TS val 646605993 ecr 646605993,nop,wscale 7], length 0
00:40:09.255318 lo    In  IP6 ip6-localhost.44954 > ip6-localhost.10350: Flags [.], ack 1, win 512, options [nop,nop,TS val 646605993 ecr 646605993], length 0
00:40:09.255318 lo    In  IP6 ip6-localhost.44964 > ip6-localhost.10350: Flags [.], ack 1, win 512, options [nop,nop,TS val 646605993 ecr 646605993], length 0
00:40:09.255803 lo    In  IP6 ip6-localhost.44964 > ip6-localhost.10350: Flags [P.], seq 1:276, ack 1, win 512, options [nop,nop,TS val 646605994 ecr 646605993], length 275
00:40:09.255832 lo    In  IP6 ip6-localhost.10350 > ip6-localhost.44964: Flags [.], ack 276, win 510, options [nop,nop,TS val 646605994 ecr 646605994], length 0
00:40:09.259852 lo    In  IP6 ip6-localhost.10350 > ip6-localhost.44964: Flags [P.], seq 1:2342, ack 276, win 512, options [nop,nop,TS val 646605998 ecr 646605994], length 2341
00:40:09.259876 lo    In  IP6 ip6-localhost.44964 > ip6-localhost.10350: Flags [.], ack 2342, win 706, options [nop,nop,TS val 646605998 ecr 646605998], length 0
00:40:09.261524 lo    In  IP6 ip6-localhost.44964 > ip6-localhost.10350: Flags [P.], seq 276:370, ack 2342, win 706, options [nop,nop,TS val 646605999 ecr 646605998], length 94
00:40:09.261642 lo    In  IP6 ip6-localhost.44964 > ip6-localhost.10350: Flags [P.], seq 370:456, ack 2342, win 706, options [nop,nop,TS val 646605999 ecr 646605998], length 86
00:40:09.261753 lo    In  IP6 ip6-localhost.44964 > ip6-localhost.10350: Flags [P.], seq 456:527, ack 2342, win 706, options [nop,nop,TS val 646606000 ecr 646605998], length 71
00:40:09.261767 lo    In  IP6 ip6-localhost.10350 > ip6-localhost.44964: Flags [.], ack 456, win 512, options [nop,nop,TS val 646605999 ecr 646605999], length 0
00:40:09.261821 lo    In  IP6 ip6-localhost.10350 > ip6-localhost.44964: Flags [P.], seq 2342:2403, ack 527, win 512, options [nop,nop,TS val 646606000 ecr 646606000], length 61
00:40:09.261887 lo    In  IP6 ip6-localhost.10350 > ip6-localhost.44964: Flags [P.], seq 2403:2447, ack 527, win 512, options [nop,nop,TS val 646606000 ecr 646606000], length 44
00:40:09.261904 lo    In  IP6 ip6-localhost.44964 > ip6-localhost.10350: Flags [P.], seq 527:558, ack 2403, win 706, options [nop,nop,TS val 646606000 ecr 646606000], length 31
00:40:09.262400 lo    In  IP6 ip6-localhost.10350 > ip6-localhost.44964: Flags [P.], seq 2447:2486, ack 558, win 512, options [nop,nop,TS val 646606000 ecr 646606000], length 39
00:40:09.262440 lo    In  IP6 ip6-localhost.44964 > ip6-localhost.10350: Flags [.], ack 2486, win 706, options [nop,nop,TS val 646606000 ecr 646606000], length 0
00:40:09.262508 lo    In  IP6 ip6-localhost.10350 > ip6-localhost.44964: Flags [P.], seq 2486:2638, ack 558, win 512, options [nop,nop,TS val 646606000 ecr 646606000], length 152
00:40:09.262563 lo    In  IP6 ip6-localhost.10350 > ip6-localhost.44964: Flags [P.], seq 2638:2671, ack 558, win 512, options [nop,nop,TS val 646606000 ecr 646606000], length 33
00:40:09.262615 lo    In  IP6 ip6-localhost.44964 > ip6-localhost.10350: Flags [.], ack 2671, win 718, options [nop,nop,TS val 646606000 ecr 646606000], length 0
00:40:09.262658 lo    In  IP6 ip6-localhost.44964 > ip6-localhost.10350: Flags [P.], seq 558:582, ack 2671, win 718, options [nop,nop,TS val 646606000 ecr 646606000], length 24
00:40:09.262698 lo    In  IP6 ip6-localhost.44964 > ip6-localhost.10350: Flags [F.], seq 582, ack 2671, win 718, options [nop,nop,TS val 646606000 ecr 646606000], length 0
00:40:09.262861 lo    In  IP6 ip6-localhost.10350 > ip6-localhost.44964: Flags [P.], seq 2671:2695, ack 583, win 512, options [nop,nop,TS val 646606001 ecr 646606000], length 24
00:40:09.262897 lo    In  IP6 ip6-localhost.44964 > ip6-localhost.10350: Flags [R], seq 4012541649, win 0, length 0
00:40:09.263605 lo    In  IP6 ip6-localhost.44954 > ip6-localhost.10350: Flags [P.], seq 1:276, ack 1, win 512, options [nop,nop,TS val 646606001 ecr 646605993], length 275
00:40:09.263624 lo    In  IP6 ip6-localhost.10350 > ip6-localhost.44954: Flags [.], ack 276, win 510, options [nop,nop,TS val 646606001 ecr 646606001], length 0
00:40:09.268730 lo    In  IP6 ip6-localhost.10350 > ip6-localhost.44954: Flags [P.], seq 1:2342, ack 276, win 512, options [nop,nop,TS val 646606006 ecr 646606001], length 2341
00:40:09.268773 lo    In  IP6 ip6-localhost.44954 > ip6-localhost.10350: Flags [.], ack 2342, win 706, options [nop,nop,TS val 646606007 ecr 646606006], length 0
00:40:09.270545 lo    In  IP6 ip6-localhost.44954 > ip6-localhost.10350: Flags [P.], seq 276:370, ack 2342, win 706, options [nop,nop,TS val 646606008 ecr 646606006], length 94
00:40:09.270654 lo    In  IP6 ip6-localhost.44954 > ip6-localhost.10350: Flags [P.], seq 370:456, ack 2342, win 706, options [nop,nop,TS val 646606008 ecr 646606006], length 86
00:40:09.270779 lo    In  IP6 ip6-localhost.10350 > ip6-localhost.44954: Flags [.], ack 456, win 512, options [nop,nop,TS val 646606009 ecr 646606008], length 0
00:40:09.271126 lo    In  IP6 ip6-localhost.10350 > ip6-localhost.44954: Flags [P.], seq 2342:2403, ack 456, win 512, options [nop,nop,TS val 646606009 ecr 646606008], length 61
00:40:09.271268 lo    In  IP6 ip6-localhost.44954 > ip6-localhost.10350: Flags [P.], seq 456:528, ack 2403, win 706, options [nop,nop,TS val 646606009 ecr 646606009], length 72
00:40:09.272123 lo    In  IP6 ip6-localhost.10350 > ip6-localhost.44954: Flags [P.], seq 2403:2447, ack 528, win 512, options [nop,nop,TS val 646606010 ecr 646606009], length 44
00:40:09.272231 lo    In  IP6 ip6-localhost.10350 > ip6-localhost.44954: Flags [P.], seq 2447:2486, ack 528, win 512, options [nop,nop,TS val 646606010 ecr 646606009], length 39
00:40:09.272296 lo    In  IP6 ip6-localhost.44954 > ip6-localhost.10350: Flags [P.], seq 528:559, ack 2486, win 706, options [nop,nop,TS val 646606010 ecr 646606010], length 31
00:40:09.272352 lo    In  IP6 ip6-localhost.10350 > ip6-localhost.44954: Flags [P.], seq 2486:2638, ack 559, win 512, options [nop,nop,TS val 646606010 ecr 646606010], length 152
00:40:09.272450 lo    In  IP6 ip6-localhost.10350 > ip6-localhost.44954: Flags [P.], seq 2638:2671, ack 559, win 512, options [nop,nop,TS val 646606010 ecr 646606010], length 33
00:40:09.272519 lo    In  IP6 ip6-localhost.44954 > ip6-localhost.10350: Flags [.], ack 2671, win 713, options [nop,nop,TS val 646606010 ecr 646606010], length 0
00:40:09.272585 lo    In  IP6 ip6-localhost.44954 > ip6-localhost.10350: Flags [P.], seq 559:583, ack 2671, win 713, options [nop,nop,TS val 646606010 ecr 646606010], length 24
00:40:09.272653 lo    In  IP6 ip6-localhost.10350 > ip6-localhost.44954: Flags [P.], seq 2671:2695, ack 583, win 512, options [nop,nop,TS val 646606010 ecr 646606010], length 24
00:40:09.272700 lo    In  IP6 ip6-localhost.10350 > ip6-localhost.44954: Flags [F.], seq 2695, ack 583, win 512, options [nop,nop,TS val 646606010 ecr 646606010], length 0
00:40:09.272800 lo    In  IP6 ip6-localhost.44954 > ip6-localhost.10350: Flags [F.], seq 583, ack 2696, win 713, options [nop,nop,TS val 646606011 ecr 646606010], length 0
00:40:09.272837 lo    In  IP6 ip6-localhost.10350 > ip6-localhost.44954: Flags [.], ack 584, win 512, options [nop,nop,TS val 646606011 ecr 646606011], length 0
00:40:09.758581 ?     P   IP 10.244.2.2 > dns.google: ICMP echo request, id 685, seq 3, length 64
00:40:09.758601 ?     In  IP 10.244.2.2 > dns.google: ICMP echo request, id 685, seq 3, length 64
00:40:09.758622 enp45s0 Out IP 172.17.0.3 > dns.google: ICMP echo request, id 685, seq 3, length 64
00:40:09.834665 enp45s0 Out IP 172.17.0.3.10351 > 172.17.0.2.10351: UDP, length 102
00:40:09.834964 enp45s0 In  IP 172.17.0.2.10351 > 172.17.0.3.10351: UDP, length 20
00:40:09.853771 enp45s0 In  IP dns.google > 172.17.0.3: ICMP echo reply, id 685, seq 3, length 64
00:40:09.853800 ?     Out IP dns.google > 10.244.2.2: ICMP echo reply, id 685, seq 3, length 64
00:40:09.853822 ?     Out IP dns.google > 10.244.2.2: ICMP echo reply, id 685, seq 3, length 64
00:40:10.121072 enp45s0 In  IP 172.17.0.2.10351 > 172.17.0.3.10351: UDP, length 102
00:40:10.121284 enp45s0 Out IP 172.17.0.3.10351 > 172.17.0.2.10351: UDP, length 20
00:40:10.758785 ?     P   IP 10.244.2.2 > dns.google: ICMP echo request, id 685, seq 4, length 64
00:40:10.758821 ?     In  IP 10.244.2.2 > dns.google: ICMP echo request, id 685, seq 4, length 64
00:40:10.758852 enp45s0 Out IP 172.17.0.3 > dns.google: ICMP echo request, id 685, seq 4, length 64
00:40:10.827073 enp45s0 In  IP dns.google > 172.17.0.3: ICMP echo reply, id 685, seq 4, length 64
00:40:10.827096 ?     Out IP dns.google > 10.244.2.2: ICMP echo reply, id 685, seq 4, length 64
00:40:10.827114 ?     Out IP dns.google > 10.244.2.2: ICMP echo reply, id 685, seq 4, length 64
00:40:10.834866 enp45s0 Out IP 172.17.0.3.10351 > 172.17.0.4.10351: UDP, length 108
00:40:10.835172 enp45s0 In  IP 172.17.0.4.10351 > 172.17.0.3.10351: UDP, length 20
00:40:11.044402 enp45s0 In  IP 172.17.0.4.6443 > 172.17.0.3.49938: Flags [P.], seq 11953:12052, ack 1082, win 9411, options [nop,nop,TS val 1019782339 ecr 3648977853], length 99
00:40:11.044403 enp45s0 In  IP 172.17.0.4.6443 > 172.17.0.3.3664: Flags [P.], seq 3949:4048, ack 36, win 615, options [nop,nop,TS val 1019782339 ecr 3865601805], length 99
00:40:11.084761 enp45s0 Out IP 172.17.0.3.49938 > 172.17.0.4.6443: Flags [.], ack 12052, win 9801, options [nop,nop,TS val 3648981234 ecr 1019782339], length 0
00:40:11.085843 enp45s0 Out IP 172.17.0.3.3664 > 172.17.0.4.6443: Flags [.], ack 4048, win 12435, options [nop,nop,TS val 3865605187 ecr 1019782339], length 0
00:40:11.120600 enp45s0 In  IP 172.17.0.2.10351 > 172.17.0.3.10351: UDP, length 102
00:40:11.120900 enp45s0 Out IP 172.17.0.3.10351 > 172.17.0.2.10351: UDP, length 20
00:40:11.206228 enp45s0 In  IP 172.17.0.4.10351 > 172.17.0.3.10351: UDP, length 108
00:40:11.206595 enp45s0 Out IP 172.17.0.3.10351 > 172.17.0.4.10351: UDP, length 20
00:40:11.834695 enp45s0 Out IP 172.17.0.3.10351 > 172.17.0.2.10351: UDP, length 102
00:40:11.834982 enp45s0 In  IP 172.17.0.2.10351 > 172.17.0.3.10351: UDP, length 20
00:40:12.229738 enp45s0 In  ARP, Request who-has 172.17.0.3 tell ubuntu, length 28
00:40:12.229772 enp45s0 Out ARP, Reply 172.17.0.3 is-at de:32:db:ee:df:b4 (oui Unknown), length 28
00:40:12.831818 ?     P   IP 10.244.2.2 > dns.google: ICMP echo request, id 687, seq 0, length 64
00:40:12.831856 ?     In  IP 10.244.2.2 > dns.google: ICMP echo request, id 687, seq 0, length 64
00:40:12.831908 enp45s0 Out IP 172.17.0.3 > dns.google: ICMP echo request, id 687, seq 0, length 64
00:40:12.835057 enp45s0 Out IP 172.17.0.3.10351 > 172.17.0.4.10351: UDP, length 108
00:40:12.835337 enp45s0 In  IP 172.17.0.4.10351 > 172.17.0.3.10351: UDP, length 20
00:40:12.888315 enp45s0 In  IP dns.google > 172.17.0.3: ICMP echo reply, id 687, seq 0, length 64
00:40:12.888336 ?     Out IP dns.google > 10.244.2.2: ICMP echo reply, id 687, seq 0, length 64
00:40:12.888354 ?     Out IP dns.google > 10.244.2.2: ICMP echo reply, id 687, seq 0, length 64
00:40:13.205951 enp45s0 In  IP 172.17.0.4.10351 > 172.17.0.3.10351: UDP, length 108
00:40:13.206310 enp45s0 Out IP 172.17.0.3.10351 > 172.17.0.4.10351: UDP, length 20
00:40:13.832057 ?     P   IP 10.244.2.2 > dns.google: ICMP echo request, id 687, seq 1, length 64
00:40:13.832085 ?     In  IP 10.244.2.2 > dns.google: ICMP echo request, id 687, seq 1, length 64
00:40:13.832113 enp45s0 Out IP 172.17.0.3 > dns.google: ICMP echo request, id 687, seq 1, length 64
00:40:13.834447 enp45s0 Out IP 172.17.0.3.10351 > 172.17.0.4.10351: UDP, length 108
00:40:13.834733 enp45s0 In  IP 172.17.0.4.10351 > 172.17.0.3.10351: UDP, length 20
00:40:14.039273 enp45s0 In  IP dns.google > 172.17.0.3: ICMP echo reply, id 687, seq 1, length 64
00:40:14.039297 ?     Out IP dns.google > 10.244.2.2: ICMP echo reply, id 687, seq 1, length 64
00:40:14.039312 ?     Out IP dns.google > 10.244.2.2: ICMP echo reply, id 687, seq 1, length 64
00:40:14.077028 enp45s0 Out IP 172.17.0.3.49938 > 172.17.0.4.6443: Flags [P.], seq 1082:1198, ack 12052, win 9801, options [nop,nop,TS val 3648984226 ecr 1019782339], length 116
00:40:14.077074 enp45s0 In  IP 172.17.0.4.6443 > 172.17.0.3.49938: Flags [.], ack 1198, win 9411, options [nop,nop,TS val 1019785372 ecr 3648984226], length 0
00:40:14.077106 enp45s0 Out IP 172.17.0.3.49938 > 172.17.0.4.6443: Flags [P.], seq 1198:1744, ack 12052, win 9801, options [nop,nop,TS val 3648984226 ecr 1019785372], length 546
00:40:14.077120 enp45s0 In  IP 172.17.0.4.6443 > 172.17.0.3.49938: Flags [.], ack 1744, win 9409, options [nop,nop,TS val 1019785372 ecr 3648984226], length 0
00:40:14.103319 enp45s0 In  IP 172.17.0.4.6443 > 172.17.0.3.49938: Flags [P.], seq 12052:12203, ack 1744, win 9411, options [nop,nop,TS val 1019785398 ecr 3648984226], length 151
00:40:14.103349 enp45s0 Out IP 172.17.0.3.49938 > 172.17.0.4.6443: Flags [.], ack 12203, win 9801, options [nop,nop,TS val 3648984252 ecr 1019785398], length 0
00:40:14.103405 enp45s0 In  IP 172.17.0.4.6443 > 172.17.0.3.49938: Flags [P.], seq 12203:12749, ack 1744, win 9411, options [nop,nop,TS val 1019785398 ecr 3648984252], length 546
00:40:14.103413 enp45s0 Out IP 172.17.0.3.49938 > 172.17.0.4.6443: Flags [.], ack 12749, win 9799, options [nop,nop,TS val 3648984252 ecr 1019785398], length 0
00:40:14.103619 enp45s0 Out IP 172.17.0.3.49938 > 172.17.0.4.6443: Flags [P.], seq 1744:1779, ack 12749, win 9801, options [nop,nop,TS val 3648984252 ecr 1019785398], length 35
00:40:14.121426 enp45s0 In  IP 172.17.0.2.10351 > 172.17.0.3.10351: UDP, length 102
00:40:14.121673 enp45s0 Out IP 172.17.0.3.10351 > 172.17.0.2.10351: UDP, length 20
00:40:14.143823 enp45s0 In  IP 172.17.0.4.6443 > 172.17.0.3.49938: Flags [.], ack 1779, win 9411, options [nop,nop,TS val 1019785439 ecr 3648984252], length 0
00:40:14.149399 enp45s0 In  IP 172.17.0.4.6443 > 172.17.0.3.49938: Flags [P.], seq 12749:12868, ack 1779, win 9411, options [nop,nop,TS val 1019785444 ecr 3648984252], length 119
00:40:14.189782 enp45s0 Out IP 172.17.0.3.49938 > 172.17.0.4.6443: Flags [.], ack 12868, win 9801, options [nop,nop,TS val 3648984339 ecr 1019785444], length 0
00:40:14.771511 enp45s0 Out IP 172.17.0.3.49938 > 172.17.0.4.6443: Flags [P.], seq 1779:1817, ack 12868, win 9801, options [nop,nop,TS val 3648984920 ecr 1019785444], length 38
00:40:14.771574 enp45s0 In  IP 172.17.0.4.6443 > 172.17.0.3.49938: Flags [.], ack 1817, win 9411, options [nop,nop,TS val 1019786066 ecr 3648984920], length 0
00:40:14.773274 enp45s0 In  IP 172.17.0.4.6443 > 172.17.0.3.49938: Flags [P.], seq 12868:12934, ack 1817, win 9411, options [nop,nop,TS val 1019786068 ecr 3648984920], length 66
00:40:14.773303 enp45s0 Out IP 172.17.0.3.49938 > 172.17.0.4.6443: Flags [.], ack 12934, win 9801, options [nop,nop,TS val 3648984922 ecr 1019786068], length 0
00:40:14.773355 enp45s0 In  IP 172.17.0.4.6443 > 172.17.0.3.49938: Flags [P.], seq 12934:17522, ack 1817, win 9411, options [nop,nop,TS val 1019786068 ecr 3648984922], length 4588
00:40:14.773364 enp45s0 Out IP 172.17.0.3.49938 > 172.17.0.4.6443: Flags [.], ack 17522, win 9779, options [nop,nop,TS val 3648984922 ecr 1019786068], length 0
00:40:14.773512 enp45s0 In  IP 172.17.0.4.6443 > 172.17.0.3.49938: Flags [P.], seq 17522:17553, ack 1817, win 9411, options [nop,nop,TS val 1019786068 ecr 3648984922], length 31
00:40:14.773521 enp45s0 Out IP 172.17.0.3.49938 > 172.17.0.4.6443: Flags [.], ack 17553, win 9801, options [nop,nop,TS val 3648984922 ecr 1019786068], length 0
00:40:14.773550 enp45s0 Out IP 172.17.0.3.49938 > 172.17.0.4.6443: Flags [P.], seq 1817:1865, ack 17553, win 9801, options [nop,nop,TS val 3648984922 ecr 1019786068], length 48
00:40:14.814792 enp45s0 In  IP 172.17.0.4.6443 > 172.17.0.3.49938: Flags [.], ack 1865, win 9411, options [nop,nop,TS val 1019786110 ecr 3648984922], length 0
00:40:14.832258 ?     P   IP 10.244.2.2 > dns.google: ICMP echo request, id 687, seq 2, length 64
00:40:14.832288 ?     In  IP 10.244.2.2 > dns.google: ICMP echo request, id 687, seq 2, length 64
00:40:14.832318 enp45s0 Out IP 172.17.0.3 > dns.google: ICMP echo request, id 687, seq 2, length 64
00:40:14.835005 enp45s0 Out IP 172.17.0.3.10351 > 172.17.0.2.10351: UDP, length 102
00:40:14.835331 enp45s0 In  IP 172.17.0.2.10351 > 172.17.0.3.10351: UDP, length 20
00:40:14.889859 enp45s0 In  IP dns.google > 172.17.0.3: ICMP echo reply, id 687, seq 2, length 64
00:40:14.889882 ?     Out IP dns.google > 10.244.2.2: ICMP echo reply, id 687, seq 2, length 64
00:40:14.889901 ?     Out IP dns.google > 10.244.2.2: ICMP echo reply, id 687, seq 2, length 64
00:40:15.205959 enp45s0 In  IP 172.17.0.4.10351 > 172.17.0.3.10351: UDP, length 108
00:40:15.206250 enp45s0 Out IP 172.17.0.3.10351 > 172.17.0.4.10351: UDP, length 20
00:40:15.832460 ?     P   IP 10.244.2.2 > dns.google: ICMP echo request, id 687, seq 3, length 64
00:40:15.832488 ?     In  IP 10.244.2.2 > dns.google: ICMP echo request, id 687, seq 3, length 64
00:40:15.832515 enp45s0 Out IP 172.17.0.3 > dns.google: ICMP echo request, id 687, seq 3, length 64
00:40:15.834863 enp45s0 Out IP 172.17.0.3.10351 > 172.17.0.4.10351: UDP, length 108
00:40:15.835222 enp45s0 In  IP 172.17.0.4.10351 > 172.17.0.3.10351: UDP, length 20
00:40:15.993940 enp45s0 In  IP dns.google > 172.17.0.3: ICMP echo reply, id 687, seq 3, length 64
00:40:15.993964 ?     Out IP dns.google > 10.244.2.2: ICMP echo reply, id 687, seq 3, length 64
00:40:15.993981 ?     Out IP dns.google > 10.244.2.2: ICMP echo reply, id 687, seq 3, length 64
00:40:16.206479 enp45s0 In  IP 172.17.0.4.10351 > 172.17.0.3.10351: UDP, length 108
00:40:16.206728 enp45s0 Out IP 172.17.0.3.10351 > 172.17.0.4.10351: UDP, length 20
00:40:16.477434 enp45s0 In  IP 172.17.0.4.59412 > 172.17.0.3.10250: Flags [S], seq 2574067392, win 64240, options [mss 1460,sackOK,TS val 1019787772 ecr 0,nop,wscale 7], length 0
00:40:16.477474 enp45s0 Out IP 172.17.0.3.10250 > 172.17.0.4.59412: Flags [S.], seq 3447645187, ack 2574067393, win 65160, options [mss 1460,sackOK,TS val 3648986626 ecr 1019787772,nop,wscale 7], length 0
00:40:16.477499 enp45s0 In  IP 172.17.0.4.59412 > 172.17.0.3.10250: Flags [.], ack 1, win 502, options [nop,nop,TS val 1019787772 ecr 3648986626], length 0
00:40:16.477886 enp45s0 In  IP 172.17.0.4.59412 > 172.17.0.3.10250: Flags [P.], seq 1:258, ack 1, win 502, options [nop,nop,TS val 1019787773 ecr 3648986626], length 257
00:40:16.477916 enp45s0 Out IP 172.17.0.3.10250 > 172.17.0.4.59412: Flags [.], ack 258, win 508, options [nop,nop,TS val 3648986627 ecr 1019787773], length 0
00:40:16.482592 enp45s0 Out IP 172.17.0.3.10250 > 172.17.0.4.59412: Flags [P.], seq 1:2298, ack 258, win 508, options [nop,nop,TS val 3648986631 ecr 1019787773], length 2297
00:40:16.482625 enp45s0 In  IP 172.17.0.4.59412 > 172.17.0.3.10250: Flags [.], ack 2298, win 538, options [nop,nop,TS val 1019787777 ecr 3648986631], length 0
00:40:16.488326 enp45s0 In  IP 172.17.0.4.59412 > 172.17.0.3.10250: Flags [P.], seq 258:1461, ack 2298, win 538, options [nop,nop,TS val 1019787783 ecr 3648986631], length 1203
00:40:16.488429 enp45s0 In  IP 172.17.0.4.59412 > 172.17.0.3.10250: Flags [P.], seq 1461:1547, ack 2298, win 538, options [nop,nop,TS val 1019787783 ecr 3648986631], length 86
00:40:16.488438 enp45s0 Out IP 172.17.0.3.10250 > 172.17.0.4.59412: Flags [.], ack 1547, win 531, options [nop,nop,TS val 3648986637 ecr 1019787783], length 0
00:40:16.488527 enp45s0 In  IP 172.17.0.4.59412 > 172.17.0.3.10250: Flags [P.], seq 1547:1677, ack 2298, win 538, options [nop,nop,TS val 1019787783 ecr 3648986637], length 130
00:40:16.489346 enp45s0 Out IP 172.17.0.3.10250 > 172.17.0.4.59412: Flags [P.], seq 2298:2359, ack 1677, win 554, options [nop,nop,TS val 3648986638 ecr 1019787783], length 61
00:40:16.489415 enp45s0 Out IP 172.17.0.3.10250 > 172.17.0.4.59412: Flags [P.], seq 2359:2403, ack 1677, win 554, options [nop,nop,TS val 3648986638 ecr 1019787783], length 44
00:40:16.489679 enp45s0 In  IP 172.17.0.4.59412 > 172.17.0.3.10250: Flags [.], ack 2403, win 538, options [nop,nop,TS val 1019787784 ecr 3648986638], length 0
00:40:16.489745 enp45s0 In  IP 172.17.0.4.59412 > 172.17.0.3.10250: Flags [P.], seq 1677:1708, ack 2403, win 538, options [nop,nop,TS val 1019787785 ecr 3648986638], length 31
00:40:16.490286 enp45s0 Out IP 172.17.0.3.49938 > 172.17.0.4.6443: Flags [P.], seq 1865:1944, ack 17553, win 9801, options [nop,nop,TS val 3648986639 ecr 1019786110], length 79
00:40:16.490320 enp45s0 In  IP 172.17.0.4.6443 > 172.17.0.3.49938: Flags [.], ack 1944, win 9411, options [nop,nop,TS val 1019787785 ecr 3648986639], length 0
00:40:16.490348 enp45s0 Out IP 172.17.0.3.49938 > 172.17.0.4.6443: Flags [P.], seq 1944:2187, ack 17553, win 9801, options [nop,nop,TS val 3648986639 ecr 1019787785], length 243
00:40:16.490362 enp45s0 In  IP 172.17.0.4.6443 > 172.17.0.3.49938: Flags [.], ack 2187, win 9410, options [nop,nop,TS val 1019787785 ecr 3648986639], length 0
00:40:16.492640 enp45s0 In  IP 172.17.0.4.6443 > 172.17.0.3.49938: Flags [P.], seq 17553:17646, ack 2187, win 9411, options [nop,nop,TS val 1019787787 ecr 3648986639], length 93
00:40:16.492682 enp45s0 In  IP 172.17.0.4.6443 > 172.17.0.3.49938: Flags [P.], seq 17646:18108, ack 2187, win 9411, options [nop,nop,TS val 1019787787 ecr 3648986639], length 462
00:40:16.492766 enp45s0 Out IP 172.17.0.3.49938 > 172.17.0.4.6443: Flags [.], ack 18108, win 9801, options [nop,nop,TS val 3648986642 ecr 1019787787], length 0
00:40:16.493021 enp45s0 Out IP 172.17.0.3.10250 > 172.17.0.4.59412: Flags [P.], seq 2403:2459, ack 1708, win 554, options [nop,nop,TS val 3648986642 ecr 1019787785], length 56
00:40:16.493872 enp45s0 Out IP 172.17.0.3.10250 > 172.17.0.4.59412: Flags [P.], seq 2459:2554, ack 1708, win 554, options [nop,nop,TS val 3648986643 ecr 1019787785], length 95
00:40:16.493916 enp45s0 Out IP 172.17.0.3.10250 > 172.17.0.4.59412: Flags [P.], seq 2554:2644, ack 1708, win 554, options [nop,nop,TS val 3648986643 ecr 1019787785], length 90
00:40:16.493935 enp45s0 In  IP 172.17.0.4.59412 > 172.17.0.3.10250: Flags [.], ack 2554, win 538, options [nop,nop,TS val 1019787789 ecr 3648986642], length 0
00:40:16.493956 enp45s0 Out IP 172.17.0.3.10250 > 172.17.0.4.59412: Flags [P.], seq 2644:2762, ack 1708, win 554, options [nop,nop,TS val 3648986643 ecr 1019787789], length 118
00:40:16.493987 enp45s0 Out IP 172.17.0.3.10250 > 172.17.0.4.59412: Flags [P.], seq 2762:2863, ack 1708, win 554, options [nop,nop,TS val 3648986643 ecr 1019787789], length 101
00:40:16.493997 enp45s0 In  IP 172.17.0.4.59412 > 172.17.0.3.10250: Flags [.], ack 2762, win 538, options [nop,nop,TS val 1019787789 ecr 3648986643], length 0
00:40:16.494025 enp45s0 Out IP 172.17.0.3.10250 > 172.17.0.4.59412: Flags [P.], seq 2863:2990, ack 1708, win 554, options [nop,nop,TS val 3648986643 ecr 1019787789], length 127
00:40:16.494056 enp45s0 Out IP 172.17.0.3.10250 > 172.17.0.4.59412: Flags [P.], seq 2990:3178, ack 1708, win 554, options [nop,nop,TS val 3648986643 ecr 1019787789], length 188
00:40:16.494068 enp45s0 In  IP 172.17.0.4.59412 > 172.17.0.3.10250: Flags [.], ack 2990, win 538, options [nop,nop,TS val 1019787789 ecr 3648986643], length 0
00:40:16.494087 enp45s0 Out IP 172.17.0.3.10250 > 172.17.0.4.59412: Flags [P.], seq 3178:3274, ack 1708, win 554, options [nop,nop,TS val 3648986643 ecr 1019787789], length 96
00:40:16.494115 enp45s0 In  IP 172.17.0.4.59412 > 172.17.0.3.10250: Flags [.], ack 3274, win 561, options [nop,nop,TS val 1019787789 ecr 3648986643], length 0
00:40:16.494170 enp45s0 Out IP 172.17.0.3.10250 > 172.17.0.4.59412: Flags [P.], seq 3274:3305, ack 1708, win 554, options [nop,nop,TS val 3648986643 ecr 1019787789], length 31
00:40:16.535796 enp45s0 In  IP 172.17.0.4.59412 > 172.17.0.3.10250: Flags [.], ack 3305, win 561, options [nop,nop,TS val 1019787831 ecr 3648986643], length 0
00:40:16.832660 ?     P   IP 10.244.2.2 > dns.google: ICMP echo request, id 687, seq 4, length 64
00:40:16.832687 ?     In  IP 10.244.2.2 > dns.google: ICMP echo request, id 687, seq 4, length 64
00:40:16.832715 enp45s0 Out IP 172.17.0.3 > dns.google: ICMP echo request, id 687, seq 4, length 64
00:40:16.835075 enp45s0 Out IP 172.17.0.3.10351 > 172.17.0.2.10351: UDP, length 102
00:40:16.835398 enp45s0 In  IP 172.17.0.2.10351 > 172.17.0.3.10351: UDP, length 20
00:40:16.897914 enp45s0 In  IP dns.google > 172.17.0.3: ICMP echo reply, id 687, seq 4, length 64
00:40:16.897936 ?     Out IP dns.google > 10.244.2.2: ICMP echo reply, id 687, seq 4, length 64
00:40:16.897953 ?     Out IP dns.google > 10.244.2.2: ICMP echo reply, id 687, seq 4, length 64
00:40:17.121277 enp45s0 In  IP 172.17.0.2.10351 > 172.17.0.3.10351: UDP, length 102
00:40:17.121493 enp45s0 Out IP 172.17.0.3.10351 > 172.17.0.2.10351: UDP, length 20
00:40:17.835164 enp45s0 Out IP 172.17.0.3.10351 > 172.17.0.2.10351: UDP, length 102
00:40:17.835435 enp45s0 In  IP 172.17.0.2.10351 > 172.17.0.3.10351: UDP, length 20
00:40:18.206961 enp45s0 In  IP 172.17.0.4.10351 > 172.17.0.3.10351: UDP, length 108
00:40:18.207191 enp45s0 Out IP 172.17.0.3.10351 > 172.17.0.4.10351: UDP, length 20
00:40:18.834419 enp45s0 Out IP 172.17.0.3.10351 > 172.17.0.4.10351: UDP, length 108
00:40:18.834619 enp45s0 In  IP 172.17.0.4.10351 > 172.17.0.3.10351: UDP, length 20
00:40:18.901899 ?     P   IP 10.244.2.2 > dns.google: ICMP echo request, id 689, seq 0, length 64
00:40:18.901932 ?     In  IP 10.244.2.2 > dns.google: ICMP echo request, id 689, seq 0, length 64
00:40:18.901975 enp45s0 Out IP 172.17.0.3 > dns.google: ICMP echo request, id 689, seq 0, length 64
00:40:18.975736 enp45s0 In  IP dns.google > 172.17.0.3: ICMP echo reply, id 689, seq 0, length 64
00:40:18.975766 ?     Out IP dns.google > 10.244.2.2: ICMP echo reply, id 689, seq 0, length 64
00:40:18.975788 ?     Out IP dns.google > 10.244.2.2: ICMP echo reply, id 689, seq 0, length 64
00:40:19.019860 enp45s0 In  IP 172.17.0.4.59422 > 172.17.0.3.10250: Flags [S], seq 31283477, win 64240, options [mss 1460,sackOK,TS val 1019790315 ecr 0,nop,wscale 7], length 0
00:40:19.019902 enp45s0 Out IP 172.17.0.3.10250 > 172.17.0.4.59422: Flags [S.], seq 3960823729, ack 31283478, win 65160, options [mss 1460,sackOK,TS val 3648989169 ecr 1019790315,nop,wscale 7], length 0
00:40:19.019925 enp45s0 In  IP 172.17.0.4.59422 > 172.17.0.3.10250: Flags [.], ack 1, win 502, options [nop,nop,TS val 1019790315 ecr 3648989169], length 0
00:40:19.020190 enp45s0 In  IP 172.17.0.4.59422 > 172.17.0.3.10250: Flags [P.], seq 1:255, ack 1, win 502, options [nop,nop,TS val 1019790315 ecr 3648989169], length 254
00:40:19.020206 enp45s0 Out IP 172.17.0.3.10250 > 172.17.0.4.59422: Flags [.], ack 255, win 508, options [nop,nop,TS val 3648989169 ecr 1019790315], length 0
00:40:19.025087 enp45s0 Out IP 172.17.0.3.10250 > 172.17.0.4.59422: Flags [P.], seq 1:2304, ack 255, win 508, options [nop,nop,TS val 3648989174 ecr 1019790315], length 2303
00:40:19.025148 enp45s0 In  IP 172.17.0.4.59422 > 172.17.0.3.10250: Flags [.], ack 2304, win 538, options [nop,nop,TS val 1019790320 ecr 3648989174], length 0
00:40:19.031056 enp45s0 In  IP 172.17.0.4.59422 > 172.17.0.3.10250: Flags [P.], seq 255:1458, ack 2304, win 538, options [nop,nop,TS val 1019790326 ecr 3648989174], length 1203
00:40:19.031179 enp45s0 In  IP 172.17.0.4.59422 > 172.17.0.3.10250: Flags [P.], seq 1458:1980, ack 2304, win 538, options [nop,nop,TS val 1019790326 ecr 3648989174], length 522
00:40:19.031195 enp45s0 Out IP 172.17.0.3.10250 > 172.17.0.4.59422: Flags [.], ack 1980, win 554, options [nop,nop,TS val 3648989180 ecr 1019790326], length 0
00:40:19.034443 lo    In  IP localhost.34984 > localhost.42343: Flags [S], seq 1807723869, win 65495, options [mss 65495,sackOK,TS val 2701362456 ecr 0,nop,wscale 7], length 0
00:40:19.034476 lo    In  IP localhost.42343 > localhost.34984: Flags [S.], seq 625530428, ack 1807723870, win 65483, options [mss 65495,sackOK,TS val 2701362456 ecr 2701362456,nop,wscale 7], length 0
